{
  "tls": true,

  "protocols": [
    "TLSv1.2"
  ],

  "ciphers": [
    "TLS_ECDHE_ECDSA_WITH_AES_256_GCM_SHA384",
    "TLS_ECDHE_ECDSA_WITH_AES_256_CBC_SHA384",
    "TLS_ECDHE_RSA_WITH_AES_256_GCM_SHA384",
    "TLS_ECDHE_RSA_WITH_AES_256_CBC_SHA384"
  ],

  "envelopes": [
    {
      "file": "src/test/resources/cases/sources/lipsum.eml"
    }
  ]
}